{"claimed_at":"2026-10-01T20:30:28+00:00","command_id":"owner-handback-claude-auto-loop-a-001-g000002","correlation_id":"handover-claude-auto-loop-a-001-g000002","event_id":"owner-claude-auto-loop-a-001-g000002","event_type":"HANDOFF","evidence_refs":["automation/command_bus/evidence/claude-auto-loop-a-001/handover-000002.json"],"expected_pr":220,"expected_repo":"kamiyusense/multi-ai-council-phase0","expected_target_head":"53f2caf67280ca1b4c019f325aea5fb9502f1114","expires_at":"2026-10-02T08:30:28+00:00","fencing_token":2,"generation":2,"holder_id":"chatgpt-semiauto-controller","loop_id":"claude-auto-loop-a-001","owner_role":"SEMI_AUTO","previous_generation":1,"previous_holder_id":"claude-auto-loop-a","previous_owner_role":"AUTO","schema_version":1,"source_receipt_id":"owner-receipt-claude-auto-loop-a-001-g000002","source_receipt_ref":"automation/command_bus/receipts/claude-auto-loop-a-001/owner-000002.json"}